{
  "$schema": "../../schemas/wire-conformance-execution-plan.schema.json",
  "protocol_version": "nnrp-1-preview4",
  "suite_version": "0.1.0",
  "target_name": "sample-preview4-target",
  "host_route_providers": [
    {
      "transport": "tcp",
      "provider_id": "nnrp.transport.tcp.native",
      "installed": true,
      "platforms": ["native"],
      "security_modes": ["plain", "tls_server_auth", "mutual_tls"]
    },
    {
      "transport": "ipc",
      "provider_id": "nnrp.transport.ipc.native",
      "installed": true,
      "platforms": ["native"],
      "security_modes": ["plain"]
    }
  ],
  "artifacts": {
    "results_path": "artifacts/wire-results.json",
    "evidence_dir": "artifacts/wire-evidence"
  },
  "scenarios": [
    {
      "id": "wire.control.cancel-abort.client",
      "mode": "suite_as_client",
      "transport": "tcp",
      "status": "experimental",
      "feature": "control.cancel_abort",
      "required_capabilities": [
        "control.cancel_abort",
        "control.result_drop_reason",
        "control.trace_context"
      ],
      "description": "Runner submits an operation, sends CANCEL, and verifies cooperative termination or a typed drop reason over the wire.",
      "steps": [
        {
          "action": "send",
          "frame": "REQUEST",
          "payload": {
            "operation_id": "op-cancel-1"
          }
        },
        {
          "action": "send",
          "frame": "CANCEL",
          "payload": {
            "operation_id": "op-cancel-1",
            "reason": "superseded"
          }
        },
        {
          "action": "receive",
          "frame": "RESULT_DROP_REASON",
          "timeout_ms": 1000
        }
      ],
      "expect": {
        "terminal": "cancelled",
        "frames": [
          "TRACE_CONTEXT",
          "RESULT_DROP_REASON"
        ]
      }
    },
    {
      "id": "wire.host-route.client.multi-route",
      "mode": "suite_as_server",
      "host_route": {
        "role": "client",
        "platform": "native",
        "application_endpoint": "nnrp://host-route.test",
        "routes": [
          {
            "transport": "tcp",
            "provider_id": "nnrp.transport.tcp.native",
            "locator": "suite://allocate/tcp/client-primary",
            "security": {"mode": "plain", "credential_owner": "none"}
          },
          {
            "transport": "ipc",
            "provider_id": "nnrp.transport.ipc.native",
            "locator": "suite://allocate/ipc/client-secondary",
            "security": {"mode": "plain", "credential_owner": "none"}
          }
        ]
      },
      "status": "mandatory",
      "feature": "host.routes",
      "required_capabilities": ["host.routes"],
      "description": "The target client receives two live provider routes, reports both candidates, and adopts exactly one runtime carrier.",
      "steps": [{"action": "connect_routes", "timeout_ms": 2000}],
      "expect": {
        "terminal": "success",
        "route": {"selected_count": 1, "atomic_rollback": false, "logical_set_closed": false}
      }
    }
  ]
}
